,sentence,pubmed_id,content,label,labeler
0,"6 |||  ||| 0.6 ||| Participants: A total of 269 patients (76% men; mean age, 64Ϯ11y) with recent acute myocardial infarction (AMI; nϭ193) or after elective percutaneous coronary intervention (PCI; nϭ76) were randomized in a ratio of 2 to 1.",15605326,76% men,po.Gender,zmj
1,"31 |||  ||| 0.31 ||| The aims of this RCT were to investigated (1) whether an 8-week course of exercise training and education program improved long-term (2y) QOL, and (2) whether the CRPP was cost effective in the provision of better QOL in patients with recent AMI or after percutaneous coronary intervention (PCI).",15605326,AMI or after percutaneous coronary intervention,po.Procedure,zmj
2,"102 ||| Patient Characteristics ||| 4.1 ||| Of the 269 Chinese patients recruited, 193 were recruited after recent AMI and 76 after elective PCI (fig 1).",15605326,269 Chinese patients,po.Size,zmj
3,"50 ||| METHODS ||| 1.19 ||| After the phase 1 ambulatory phase, the control group received conventional therapy without undergoing the outpatient exercise training program.",15605326,conventional therapy,i.Procedure,zmj
4,7 |||  ||| 0.7 ||| Intervention: Patients received either CRPP (an 8-wk exercise and education class in phase 2) or conventional therapy without exercise program (control group).,15605326,CRPP (an 8-wk exercise and education class in phase 2),i.Procedure,zmj
5,"50 ||| METHODS ||| 1.19 ||| After the phase 1 ambulatory phase, the control group received conventional therapy without undergoing the outpatient exercise training program.",15605326,undergoing the outpatient exercise training program,i.Procedure,zmj
6,"53 ||| METHODS ||| 1.22 ||| The control group also attended a 2-hour talk that explained the disease, the importance of risk-factor modification, and the potential benefits of physical activity.",15605326,a 2-hour talk that explained the disease,i.Procedure,zmj
7,"20 |||  ||| 0.20 ||| Conclusions: In an era of managing patients with coronary heart disease, a short-course CRPP was highly cost effective in providing better QOL to patients with recent AMI or after elective PCI.",15605326,a short-course CRPP was highly cost effective,o.Treatment,zmj
8,"21 |||  ||| 0.21 ||| In addition, the improvement of QOL was quick and sustained for at least 2 years after CRPP.",15605326,he improvement of QOL was quick and sustained,o.Treatment,zmj
